<?xml version="1.0" encoding="UTF-8"?>
<?xml-stylesheet type="text/xsl" href="cv.xsl"?>
<cv xmlns="http://portfolio.gouzerh.fr/cv"
    xmlns:xsi="http://www.w3.org/2001/XMLSchema-instance"
    xsi:schemaLocation="http://portfolio.gouzerh.fr/cv cv.xsd">

  <metadata>
    <languesDisponibles>
      <langue>fr-FR</langue>
      <langue>en-GB</langue>
      <langue>zh-CN</langue>
    </languesDisponibles>
    <derniereModification>2025-01-15</derniereModification>
    <version>1.0</version>
  </metadata>

  <identite>
    <prenom>Katell</prenom>
    <nom>GOUZERH</nom>
    <dateNaissance>2003-04-05</dateNaissance>
    <lieuNaissance>
      <traduction lang="fr-FR">Quimper, France</traduction>
      <traduction lang="en-GB">Quimper, France</traduction>
      <traduction lang="zh-CN">法国坎佩尔</traduction>
    </lieuNaissance>
    <nationalite>
      <traduction lang="fr-FR">Française</traduction>
      <traduction lang="en-GB">French</traduction>
      <traduction lang="zh-CN">法国</traduction>
    </nationalite>
    <titre>
      <traduction lang="fr-FR">Alternante Ingénieur Informatique</traduction>
      <traduction lang="en-GB">Computer Engineering Intern</traduction>
      <traduction lang="zh-CN">计算机工程实习生</traduction>
    </titre>
    <presentation>
      <traduction lang="fr-FR">Je suis à la recherche d'un contrat d'apprentissage de 24 mois, à raison d'un mois sur deux en entreprise. Je suis disponible dès septembre 2024</traduction>
      <traduction lang="en-GB">I am looking for an apprenticeship contract of 24 months, at the rate of one month out of two in the company. I am available from September 2024.</traduction>
      <traduction lang="zh-CN">我正在寻找为期24个月的学徒合同，每两个月在公司工作一个月。我从2024年9月开始可以工作。</traduction>
    </presentation>
    <photo>katell.jpg</photo>
  </identite>

  <contacts>
    <contact id="tel">
      <type>telephone</type>
      <valeur>06 46 63 89 89</valeur>
      <libelle>
        <traduction lang="fr-FR">Téléphone</traduction>
        <traduction lang="en-GB">Phone</traduction>
        <traduction lang="zh-CN">电话</traduction>
      </libelle>
    </contact>
    <contact id="email">
      <type>email</type>
      <valeur>katell.gouzerh@hotmail.com</valeur>
      <libelle>
        <traduction lang="fr-FR">Mail</traduction>
        <traduction lang="en-GB">Email</traduction>
        <traduction lang="zh-CN">邮箱</traduction>
      </libelle>
    </contact>
    <contact id="adresse">
      <type>adresse</type>
      <valeur>75020 Paris</valeur>
      <libelle>
        <traduction lang="fr-FR">Adresse</traduction>
        <traduction lang="en-GB">Address</traduction>
        <traduction lang="zh-CN">地址</traduction>
      </libelle>
    </contact>
    <contact id="linkedin">
      <type>linkedin</type>
      <valeur>@katell-gouzerh</valeur>
      <libelle>
        <traduction lang="fr-FR">LinkedIn</traduction>
        <traduction lang="en-GB">LinkedIn</traduction>
        <traduction lang="zh-CN">领英</traduction>
      </libelle>
    </contact>
  </contacts>

  <formations>
    <formation id="form1">
      <diplome>
        <traduction lang="fr-FR">Formation d'Ingénieur Informatique</traduction>
        <traduction lang="en-GB">Computer Engineering Training</traduction>
        <traduction lang="zh-CN">计算机工程培训</traduction>
      </diplome>
      <etablissement>
        <traduction lang="fr-FR">Sup Galilée, Université Sorbonne Paris Nord</traduction>
        <traduction lang="en-GB">Sup Galilée, Université Sorbonne Paris Nord</traduction>
        <traduction lang="zh-CN">索邦巴黎北大学伽利略学院</traduction>
      </etablissement>
      <lieu>
        <traduction lang="fr-FR">Villetaneuse</traduction>
        <traduction lang="en-GB">Villetaneuse</traduction>
        <traduction lang="zh-CN">维勒塔纳斯</traduction>
      </lieu>
      <periode>
        <debut>2023</debut>
      </periode>
    </formation>
    
    <formation id="form2">
      <diplome>
        <traduction lang="fr-FR">Cursus Préparatoire Ingénieur Intégré (CP2I)</traduction>
        <traduction lang="en-GB">Integrated Engineering Preparatory Training (CP2I)</traduction>
        <traduction lang="zh-CN">综合工程预科培训</traduction>
      </diplome>
      <etablissement>
        <traduction lang="fr-FR">Sup Galilée, Université Sorbonne Paris Nord</traduction>
        <traduction lang="en-GB">Sup Galilée, Université Sorbonne Paris Nord</traduction>
        <traduction lang="zh-CN">索邦巴黎北大学伽利略学院</traduction>
      </etablissement>
      <lieu>
        <traduction lang="fr-FR">Villetaneuse</traduction>
        <traduction lang="en-GB">Villetaneuse</traduction>
        <traduction lang="zh-CN">维勒塔纳斯</traduction>
      </lieu>
      <periode>
        <debut>2021</debut>
        <fin>2023</fin>
      </periode>
      <options>
        <traduction lang="fr-FR">Internet of Things, Domaine d'Application de l'Informatique, Conception Algorithmique, Initiation aux Interfaces graphiques, Méthode Algébrique Pour l'Informatique</traduction>
        <traduction lang="en-GB">Internet of Things, Field of Application of Computer Science, Algorithmic Design, Introduction to Graphical Interfaces, Algebraic Method for Computer Science</traduction>
        <traduction lang="zh-CN">物联网，计算机科学应用领域，算法设计，图形界面入门，计算机代数方法</traduction>
      </options>
    </formation>
  </formations>

  <experiences>
    <experience id="exp1" type="professionnel">
      <poste>
        <traduction lang="fr-FR">Alternante en Informatique</traduction>
        <traduction lang="en-GB">Computer Science Intern</traduction>
        <traduction lang="zh-CN">计算机科学实习生</traduction>
      </poste>
      <entreprise>
        <traduction lang="fr-FR">À définir</traduction>
        <traduction lang="en-GB">To be defined</traduction>
        <traduction lang="zh-CN">待定</traduction>
      </entreprise>
      <lieu>
        <traduction lang="fr-FR">Paris</traduction>
        <traduction lang="en-GB">Paris</traduction>
        <traduction lang="zh-CN">巴黎</traduction>
      </lieu>
      <periode>
        <debut>2025</debut>
      </periode>
    </experience>

    <experience id="exp2" type="professionnel">
      <poste>
        <traduction lang="fr-FR">Animatrice de colonie de vacances</traduction>
        <traduction lang="en-GB">Summer Camp Activity Leader</traduction>
        <traduction lang="zh-CN">夏令营活动领导者</traduction>
      </poste>
      <entreprise>
        <traduction lang="fr-FR">CSEC Total, Barioz</traduction>
        <traduction lang="en-GB">CSEC Total, Barioz</traduction>
        <traduction lang="zh-CN">CSEC道达尔，巴里奥兹</traduction>
      </entreprise>
      <lieu>
        <traduction lang="fr-FR">Barioz</traduction>
        <traduction lang="en-GB">Barioz</traduction>
        <traduction lang="zh-CN">巴里奥兹</traduction>
      </lieu>
      <periode>
        <debut>2021</debut>
        <fin>2023</fin>
      </periode>
      <taches>
        <tache>
          <traduction lang="fr-FR">Membre d'une équipe d'animateurs s'occupant d'une cinquantaine d'enfants de 6 à 12 ans pendant 3 semaines</traduction>
          <traduction lang="en-GB">Member of a team of activity leaders taking care of about fifty children aged six to twelve for three weeks</traduction>
          <traduction lang="zh-CN">作为活动领导团队的一员，照顾约50名6-12岁的儿童，为期3周</traduction>
        </tache>
        <tache>
          <traduction lang="fr-FR">Responsable Convoyage en 2022 et 2023</traduction>
          <traduction lang="en-GB">Transport Manager in 2022 and 2023</traduction>
          <traduction lang="zh-CN">2022年和2023年负责护送工作</traduction>
        </tache>
        <tache>
          <traduction lang="fr-FR">Surveillante Baignade en 2023 (PSC1 ET BSB obtenus en juillet 2023)</traduction>
          <traduction lang="en-GB">Swimming Supervisor in 2023 (PSC1 and BSB obtained in July 2023)</traduction>
          <traduction lang="zh-CN">2023年游泳监督员（2023年7月获得PSC1和BSB证书）</traduction>
        </tache>
      </taches>
    </experience>
    
    <experience id="exp3" type="professionnel">
      <poste>
        <traduction lang="fr-FR">Animatrice</traduction>
        <traduction lang="en-GB">Activity Leader</traduction>
        <traduction lang="zh-CN">活动领导者</traduction>
      </poste>
      <entreprise>
        <traduction lang="fr-FR">Mairie de Montreuil</traduction>
        <traduction lang="en-GB">Montreuil City Hall</traduction>
        <traduction lang="zh-CN">蒙特勒伊市政厅</traduction>
      </entreprise>
      <lieu>
        <traduction lang="fr-FR">St Bris-Le-Vineux</traduction>
        <traduction lang="en-GB">St Bris-Le-Vineux</traduction>
        <traduction lang="zh-CN">圣布里斯勒维诺</traduction>
      </lieu>
      <periode>
        <debut>2023</debut>
        <fin>2023</fin>
      </periode>
      <taches>
        <tache>
          <traduction lang="fr-FR">Membre d'une équipe d'animateurs s'occupant d'une cinquantaine d'enfants de 4 à 7 ans pendant 10 jours</traduction>
          <traduction lang="en-GB">Member of a team of activity leaders taking care of about fifty children aged four to seven for ten days</traduction>
          <traduction lang="zh-CN">作为活动领导团队的一员，照顾约50名4-7岁的儿童，为期10天</traduction>
        </tache>
      </taches>
    </experience>
    
    <experience id="exp4" type="complementaire">
      <poste>
        <traduction lang="fr-FR">Membre du Bureau des Étudiants</traduction>
        <traduction lang="en-GB">Member of the Student Board</traduction>
        <traduction lang="zh-CN">学生会成员</traduction>
      </poste>
      <entreprise>
        <traduction lang="fr-FR">Sup Galilée</traduction>
        <traduction lang="en-GB">Sup Galilée</traduction>
        <traduction lang="zh-CN">伽利略学院</traduction>
      </entreprise>
      <lieu>
        <traduction lang="fr-FR">Villetaneuse</traduction>
        <traduction lang="en-GB">Villetaneuse</traduction>
        <traduction lang="zh-CN">维勒塔纳斯</traduction>
      </lieu>
      <periode>
        <debut>2022</debut>
        <fin>2025</fin>
      </periode>
      <taches>
        <tache>